{
  "$schema": "https://code.claude.com/schemas/marketplace.json",
  "name": "builder",
  "owner": { "name": "Parcel", "url": "https://www.parcelengineering.com" },
  "description": "Parcel's builder plugin: connect an AI client to Parcel and use open Parcel skills.",
  "plugins": [
    {
      "name": "builder",
      "source": "./plugin",
      "description": "Parcel's builder plugin: connect an AI client to Parcel and use open Parcel skills.",
      "version": "0.3.1",
      "author": { "name": "Parcel" },
      "license": "Apache-2.0",
      "homepage": "https://github.com/nick-parcel/builder",
      "repository": "https://github.com/nick-parcel/builder",
      "category": "productivity",
      "strict": true
    }
  ]
}
